<?xml version="1.0" encoding="UTF-8"?>
<MVC-MAIN	xmlns="http://www.jessma.org"
			xmlns:xsi="http://www.w3.org/2001/XMLSchema-instance"
			xsi:schemaLocation="http://www.jessma.org http://www.jessma.org/schema/mvc-config-main-3.3.xsd">
	<global>
		<!-- request 和 response 的默认编码（可选，默认：不设置） -->
		<encoding>UTF-8</encoding>
		<!-- Action 请求的后缀（可选，默认：.action） -->
		<action-suffix>.action</action-suffix>
		<!-- 页面的  ${__base}  变量设置（可选，默认：type = 'auto', href = ''） -->
		<base-path type="auto"/>

		<!--
			default-locale	：应用程序默认语言选项（默认：与当前操作系统一致）
			default-bundle	：应用程序默认 Bundle（默认：res.application-message）
		-->
		<i18n default-locale="" default-bundle="" />
		
		<!--
			enable		：是否开启 Bean Validation 机制（默认：开启）
			bundle		：验证文本消息的 Bundle（默认：res.validation-message）
			validator	：验证器类（默认：org.jessma.mvc.validation.HibernateBeanValidator）
		-->
		<bean-validation
			enable="true"
			bundle=""
			validator=""
		/>

		<!-- Action Convention 配置
			enable					：是否启用 Action Convention 功能（默认：true）
			detect-physical-file	：是否检查 Action Result 物理视图文件的确存在（默认：true）
			action-base-package		：Action 类的基包（默认：""）
			dispatch-file-path		：转发视图的基路径（默认："/WEB-INF/page"）
			dispatch-file-type		：转发视图的类型（默认："jsp"）
			physical-file-path		：物理视图文件的基路径（默认：""，与 'dispatch-file-path' 一致）
			file-name-separator		：视图名称分隔符（默认："_"）
		-->
		<action-convention
			enable="true"
			detect-physical-file="true"
			action-base-package="action"
			dispatch-file-path="${jsp-base}"
			dispatch-file-type="jsp"
			physical-file-path=""
			file-name-separator="_"
		/>
		
		<action-filters>
		<!--  
			<filter pattern="action.*" class="global.MyActionFilter1"/>
			<filter pattern="action.test.CheckBean.+" class="global.MyActionFilter2"/>
			<filter pattern="action.fake.*" class="global.MyActionFilter3"/>
			<filter pattern="action.test.UserAction" methods="(?!find|execute)\w*" class="global.UserActionFilter"/>
		-->
			<filter class="org.jessma.mvc.i18n.URLI18nFilter"/>
			<filter class="org.jessma.mvc.i18n.CookieI18nFilter"/>
			<!-- <filter class="org.jessma.mvc.i18n.BrowserI18nFilter"/> -->
			<filter pattern=".*" class="org.jessma.dao.DaoInjectFilter"/>
			<filter pattern=".*" class="org.jessma.ext.spring.SpringInjectFilter"/>
			<filter pattern=".*" class="guice.MyGuiceInjectFilter"/>
		</action-filters>
		
		<!-- 设置 Action Result 路径的全局别名 -->
		<result-path-aliases>
			<alias name="jsp-base" path="/jsp"/>
			<alias name="index" path="${jsp-base}/index.jsp"/>
			<alias name="jsp-path" path="${jsp-base}/test"/>
			<alias name="ftl-path" path="/ftl/test"/>
		</result-path-aliases>
		
		<global-results>
			<!-- MVC 框架会自动加入 'none' global result -->
			<!-- <result name="none" /> -->
		</global-results>
	</global>
	
	<include file="mvc-config-t.xml"/>
	
	<actions>
		<action name="index" class="action.test.IndexAction">
			<result>${index}</result>
		</action>
	</actions>
</MVC-MAIN>